A社がシステム開発を行うに当たり，外部業者B社を利用する場合の契約に関する記述のうち，適切なものはどれか。,2,委任契約ではB社に成果物の完成責任がないので，A社がB社の従業員に対して直接指揮命令権を行使する。,請負契約によるシステム開発では，特に契約に定めない限り，開発されたプログラムの著作権はB社に帰属する。,請負契約，派遣契約によらず，いずれの場合のシステム開発でも，B社にはシステムの完成責任がある。,派遣契約では，開発されたプログラムに重大な欠陥が発生した場合，B社に瑕疵(かし)担保責任がある。,平成22年秋期 午前問79
日本において，産業財産権と総称される四つの権利はどれか。,1,意匠権，実用新案権，商標権，特許権,意匠権，実用新案権，著作権，特許権,意匠権，商標権，著作権，特許権,実用新案権，商標権，著作権，特許権,平成22年秋期 午前問78
ヒストグラムを説明したものはどれか。,3,原因と結果の関連を魚の骨のような形態に整理して体系的にまとめ，結果に対してどのような原因が関連しているかを明確にする。,時系列的に発生するデータのばらつきを折れ線グラフで表し，管理限界線を利用して客観的に管理する。,収集したデータを幾つかの区間に分類し，各区間に属するデータの個数を棒グラフとして描き，ばらつきをとらえる。,データを幾つかの項目に分類し，出現頻度の大きさの順に棒グラフとして並べ，累積和を折れ線グラフで描き，問題点を絞り込む。,平成22年秋期 午前問76
プロジェクトを準独立的な事業として遂行し，その成果に対して全面的な責任を負う起業者としての権限と責任を与えられる組織構造はどれか。,2,事業部制組織,社内ベンチャ組織,職能別組織,マトリックス組織,平成22年秋期 午前問74
セル生産方式の特徴はどれか。,4,各工程が自立的に稼動し，前工程の生産したものを元に後工程の生産を行う。,作業指示と現場管理を見えるようにするために，かんばんを利用する。,必要とする部品，仕様，数量を後工程から前工程に伝達する。,部品の組立てから完成検査までの全工程を，1人又は数人で作業する。,平成22年秋期 午前問73
ディジタルディバイドを説明したものはどれか。,4,PCなどの情報通信機器の利用方法が分からなかったり，情報通信機器を所有していなかったりして，情報の入手が困難な人々のことである。,高齢者や障害者の情報通信の利用面での困難が，社会的・経済的格差につながらないように，だれもが情報通信を利活用できるように整備された環境のことである。,情報通信機器やソフトウェア，情報サービスなどを，高齢者・障害者を含むすべての人が利用可能であるか，利用しやすくなっているかの度合いのことである。,情報リテラシの有無やITの利用環境の相違などによって生じる，社会的又は経済的格差のことである。,平成22年秋期 午前問72
XBRLを説明したものはどれか。,4,インターネットのホームページにおける画像，音声，ビデオなどを含むページを表現できるページ記述言語である。,テキストや画像だけでなく，レイアウトやフォントの情報などもファイルに納めることができる文書表示用のフォーマットである。,当初は小型コンピュータ用に開発された，様々な帳票を簡単に作成することを主たる目的としたプログラム言語である。,文書情報やデータの構造を記述するためのマークアップ言語であるXMLを，財務情報の交換に応用したデータ記述言語である。,平成22年秋期 午前問71
サプライチェーンマネジメントを説明したものはどれか。,1,購買，生産，販売及び物流を結ぶ一連の業務を，企業間で全体最適の視点から見直し，納期短縮や在庫削減を図る。,個人がもっているノウハウや経験などの知的資産を共有して，創造的な仕事につなげていく。,社員のスキルや行動特性を管理し，人事戦略の視点から適切な人員配置・評価などを行う。,多様なチャネルを通じて集められた顧客情報を一元化し，活用することで，顧客との関係を密接にしていく。,平成22年秋期 午前問70
バランススコアカードの四つの視点とは，財務，学習と成長，内部ビジネスプロセスと，もう一つはどれか。,2,ガバナンス,顧客,自社の強み,遵法,平成22年秋期 午前問69
プロダクトライフサイクルにおける成長期の特徴はどれか。,1,市場が商品の価値を理解し始める。商品ラインもチャネルも拡大しなければならない。この時期は売上も伸びるが，投資も必要である。,需要が大きくなり，製品の差別化や市場の細分化が明確になってくる。競争者間の競争も激化し，新品種の追加やコストダウンが重要となる。,需要が減ってきて，撤退する企業も出てくる。この時期の強者になれるかどうかを判断し，代替市場への進出なども考える。,需要は部分的で，新規需要開拓が勝負である。特定ターゲットに対する信念に満ちた説得が必要である。,平成22年秋期 午前問68
競争上のポジションで，フォロワの基本戦略はどれか。,2,シェア追撃などのリーダ攻撃に必要な差別化戦略,市場チャンスに素早く対応する模倣戦略,製品，市場の専門特化を図る特定化戦略,全市場をカバーし，最大シェアを確保する全方位戦略,平成22年秋期 午前問67
システムインテグレータの説明として，適切なものはどれか。,2,自社の業務過程の一部を，より得意とする外部の企業に委託する。,情報システムの企画，構築，運用などの業務を一括して請け負う。,ソフトウェアの必要な機能だけを選択して購入できる。,ビジネス用のアプリケーションソフトウェアをインターネットでレンタルする。,平成22年秋期 午前問66
利害関係者要件の確認において，定義された要件に対して，発生した変更要求の実装までの経過を明らかにできることを表すものはどれか。,3,インターオペラビリティ,セキュリティ,トレーサビリティ,ユーザビリティ,平成22年秋期 午前問65
非機能要件の定義に該当するものはどれか。,2,業務を構成する機能間の情報(データ)の流れを明確にする。,システム開発で利用する言語に合わせた開発基準，標準を作成する。,システム機能として実現する範囲を定義する。,他システムとの情報授受などのインタフェースを明確にする。,平成22年秋期 午前問64
SOAを説明したものはどれか。,3,企業グループ全体の業務プロセスを統合的に管理し，経営資源を有効活用することによって，経営の効率向上を図る考え方のことである。,業務の流れを単位ごとに分析し整理することによって問題点を明確化し，効果的に，また効率よく仕事ができるように継続的に改善する管理手法である。,再利用可能なサービスとしてソフトウェアコンポーネントを構築し，そのサービスを活用することで高い生産性を実現するアーキテクチャである。,自社の業務の一部を，業務システムだけでなく業務そのものを含めて，企画から運用までを一括して外部企業に委託することである。,平成22年秋期 午前問63
"システム管理基準" によれば，情報化投資計画を策定する段階はどれか。,4,運用業務,開発業務,企画業務,情報戦略,平成22年秋期 午前問62
エンタープライズアーキテクチャにおいて，テクノロジアーキテクチャで作成する成果物はどれか。,4,機能構成図(DMM)，機能情報関連図(DFD),実体関連ダイアグラム(ERD)，データ定義表,情報システム関連図，情報システム機能構成図,ネットワーク構成図，ソフトウェア構成図,平成22年秋期 午前問61
ユーザ受入れテストの監査において，指摘事項に該当するものはどれか。,1,システム部門だけでテストを行い，テスト結果をその責任者が承認した。,当該業務に精通したユーザが参画してテストを行った。,ユーザ受入れテストの実施環境は本番環境と隔離させた。,ユーザ要求をすべてテスト対象としたテストケースを設定した。,平成22年秋期 午前問60
経営者が社内のシステム監査人の外観上の独立性を担保とするために講じる措置として，適切なものはどれか。,4,システム監査人にITに関する継続的学習を義務付ける。,システム監査人に必要な知識や経験を定め，公表する。,システム監査人の監査技法修得制度を設ける。,システム監査人の所属部署を経営者の直轄とする。,平成22年秋期 午前問59
システム監査におけるヒアリングを実施する際に，システム監査人の対処として，適切なものはどれか。,2,ヒアリングの結果，調査対象の現状に問題があると判断した場合は，その調査対象のあるべき姿について被監査部門の専門的な相談に応じる。,ヒアリングの結果，問題と思われる事項を発見した場合は，その裏付けとなる記録の入手や現場確認を行う。,ヒアリングを行っている際に，被監査部門との間で見解の相違が生じた場合は，相手が納得するまで十分に議論を行う。,被監査部門のヒアリング対象者が複数の場合は，職制上の上位者から集中的に話を聞く。,平成22年秋期 午前問58
ニューメリックチェックの説明として，適切なものはどれか。,2,一定の規則に従ってデータから検査文字を算出し，付加されている検査文字と比較することによって，入力データに誤りがないかどうかをチェックする。,数値として扱う必要のあるデータに，数値として扱えない文字のようなものが含まれていないかどうかをチェックする。,販売数と在庫数と仕入数の関係など，関連のある項目の値に矛盾がないかどうかをチェックする。,マスタファイル作成時の入力データ中に，キーの値が同じレコードが複数件含まれていないかどうかをチェックする。,平成22年秋期 午前問57
データベースのロールバック処理の説明はどれか。,4,更新後ジャーナルを用いて，トランザクション開始後の障害直前の状態にまでデータを復旧させる。,更新後ジャーナルを用いて，トランザクション開始直前の状態にまでデータを復旧させる。,更新前ジャーナルを用いて，トランザクション開始後の障害直前の状態にまでデータを復旧させる。,更新前ジャーナルを用いて，トランザクション開始直前の状態にまでデータを復旧させる。,平成22年秋期 午前問56
EUCの説明として，適切なものはどれか。,4,エディタ，コンパイラ，デバッガなどプログラミングに必要なツールが一つに統合され，一つのインタフェースで扱えるようになっている開発環境である。,簡易なGUI構築，ウィザードによるプログラムスケルトンの作成，ASP(ActiveServerPages)の利用などによって，Web 環境で稼動するシステムを開発することである。,簡易なGUI構築ツールを使って，システム開発の初期の段階で画面を作成し，機能や操作性などを確認しながら，開発を行う手法である。,利用者自身が，表計算ソフトや簡易データベースなどを活用し，業務を遂行することである。,平成22年秋期 午前問55
リスク識別に使用する技法の一つであるデルファイ法の説明はどれか。,4,確率分布を使用したシミュレーションを行う。,過去の情報や知識を基にして，あらかじめ想定されるリスクをチェックリストにまとめておき，チェックリストと照らし合わせることでリスクを識別する。,何人かが集まって，他人のアイディアを批判することなく，自由に多くのアイディアを出し合う。,複数の専門家から得られた匿名の見解を要約して，再配布することを何度か繰り返して収束される。,平成22年秋期 午前問54
組込みシステムの特許におけるライセンスに関する記述として，適切なものはどれか。,1,新開発した組込み製品のハードウェア部分だけが，他社の特許に抵触している場合，その部分のライセンスを得ないと権利侵害になる。,他社の特許がハードウェアとソフトウェアとの両方を権利範囲に含む場合，ハードウェア部分のライセンスを得れば，ソフトウェア部分は模倣して製品化できる。,ハードウェア部分の特許とソフトウェア部分の特許をそれぞれ異なる会社が保有している場合，ライセンスを得て製品化することはできない。,ハードウェア部分の特許のライセンスを得て，ソフトウェア部分だけは社内で独自に新規開発した場合，このソフトウェアを特許出願することはできない。,平成22年秋期 午前問50
JavaScriptの非同期通信の機能を使うことによって，動的なユーザインタフェースを画面遷移を伴わずに実現する技術はどれか。,1,Ajax,CSS,RSS,SNS,平成22年秋期 午前問49
ブラックボックステストにおけるテストケースの設計方法として，適切なものはどれか。,2,プログラム仕様書の作成又はコーディングが終了した段階で，仕様書やソースリストを参照して，テストケースを設計する。,プログラムの機能仕様やインタフェースの仕様に基づき，テストケースを設計する。,プログラムの処理手順，すなわちロジック経路に基づき，テストケースを設計する。,プログラムのすべての条件判定で，真と偽をそれぞれ1回以上実行させることを基準に，テストケースを設計する。,平成22年秋期 午前問48
オブジェクト指向におけるクラスとインスタンスとの関係のうち，適切なものはどれか。,2,インスタンスはクラスの仕様を定義したものである。,クラスの定義に基づいてインスタンスが生成される。,一つのインスタンスに対して，複数のクラスが対応する。,一つのクラスに対して，インスタンスはただ一つ存在する。,平成22年秋期 午前問47
オブジェクト指向において，属性と振る舞いを一つにまとめた構造にすることを何というか。,1,カプセル化,クラス化,集約化,汎化,平成22年秋期 午前問46
DFD表記方法として，適切なものはどれか。,4,2本の平行線は同期を意味し，名前は付けない。,円には，データを蓄積するファイルの名前を付ける。,四角には，入力画面や帳票を現す名前を付ける。,矢印には，データを表す名前を付ける。,平成22年秋期 午前問45
企業ネットワークやサーバにおいて，侵入者が通常のアクセス経路以外で侵入するために組み込むものはどれか。,3,シンクライアントエージェント,ストリクトルーティング,バックドア,フォレンジック,平成22年秋期 午前問44
リスク移転に該当するものはどれか。,2,損失の発生率を低下させること,保険に加入するなどで他者と損失の負担を分担すること,リスクの原因を除去すること,リスクを扱いやすい単位に分解するか集約すること,平成22年秋期 午前問43
災害を想定した事業継続計画(BCP)を策定する場合に行うビジネスインパクト分析での実施事項はどれか。,2,BCPの有効性を検証するためのテストを実施する。,許容される最大停止時間を決定する。,代替手順や復旧手順について関係者を集め教育する。,内外の環境の変化を踏まえBCPの内容を見直す。,平成22年秋期 午前問42
手順に示す電子メールの送受信によって得られるセキュリティ上の効果はどれか。     〔手順〕     (1):送信者は，電子メールの本文を共通鍵暗号方式で暗号化し(暗号文)，その共通鍵を受信者の公開鍵を用いて公開鍵暗号方式で暗号化する(共通鍵の暗号化データ)。     (2):送信者は，暗号文と共通鍵の暗号化データを電子メールで送信する。     (3):受信者は，受信した電子メールから取り出した共通鍵の暗号化データを，自分の秘密鍵を用いて公開鍵暗号方式で復号し，得た共通鍵で暗号文を復号する。,4,送信者による電子メールの送達確認,送信者のなりすましの検出,電子メールの本文の改ざんの有無の検出,電子メールの本文の内容の漏えいの防止,平成22年秋期 午前問41
バイオメトリクス認証には身体的特徴を抽出して認証する方式と行動的特徴を抽出して認証する方式がある。行動的特徴を用いているものはどれか。,2,血管の分岐点の分岐角度や分岐点間の長さから特徴を抽出して認証する。,署名するときの速度や筆圧から特徴を抽出して認証する。,どう孔から外側に向かって発生するカオス状のしわの特徴を抽出して認証する。,隆線によって形作られる紋様からマニーシャと呼ばれる特徴点を抽出して認証する。,平成22年秋期 午前問40
ルータがパケットの経路決定に用いる情報として，最も適切なものはどれか。,1,あて先IPアドレス,あて先MACアドレス,発信元IPアドレス,発信元MACアドレス,平成22年秋期 午前問36
複数のLANを接続するために用いる装置で，OSI基本参照モデルのデータリンク層のプロトコル情報に基づいてデータを中継する装置はどれか。,2,ゲートウェイ,ブリッジ,リピータ,ルータ,平成22年秋期 午前問35
OSI基本参照モデルにおけるネットワーク層の説明として，適切なものはどれか。,1,エンドシステム間のデータ伝送を実現するために，ルーティングや中継などを行う。,各層のうち，最も利用者に近い部分であり，ファイル転送や電子メールなどの機能が実現されている。,物理的な通信媒体の特性の差を吸収し，上位の層に透過的な伝送路を提供する。,隣接ノード間の伝送制御手順(誤り検出，再送制御など)を提供する。,平成22年秋期 午前問34
データベースのアクセス効率を低下させないために，定期的に実施する処理はどれか。,1,再編成,データベースダンプ,バックアップ,ロールバック,平成22年秋期 午前問32
関係データベースにおいて，表から特定の列を得る操作はどれか。,3,結合,削除,射影,選択,平成22年秋期 午前問30
3次元グラフィック処理におけるクリッピングの説明はどれか。,2,CG映像作成における最終段階として，物体のデータをディスプレイに描画できるように映像化する処理である。,画像表示域にウィンドウを定義し，ウィンドウ内の見える部分だけを取り出す処理である。,モデリングされた物体の表面に柄や模様などをはり付ける処理である。,立体感を生じさせるため，物体の表面に陰付けを行う処理である。,平成22年秋期 午前問28
使用性(ユーザビリティ)の規格(JIS Z 8521)では，使用性を“ある製品が，指定された利用者によって，指定された利用の状況下で，指定された目的を達成するために用いられる際の，有効さ，効率及び利用者の満足度の度合い”と定義している。この定義中の“利用者の満足度”を評価するときに用いる方法はどれか。,1,インタビュー法,ヒューリスティック評価,ユーザビリティテスト,ログデータ分析法,平成22年秋期 午前問27
フラッシュメモリの説明として，適切なものはどれか。,4,書込み回数は無制限である。,書込み時は回路基板から外して，専用のROMライタで書き込まなければならない。,定期的にリフレッシュしないと，データが失われる。,データの書き換え時には，あらかじめ前のデータを消去してから書き込みを行う。,平成22年秋期 午前問26
プログラムの静的解析ツールで検出できるものはどれか。,2,関数ごとの実行処理時間,後に使用されない変数への代入,プログラム仕様に対する処理の記述漏れ,用意したテストケースでは実行されなかった命令,平成22年秋期 午前問23
コンパイラによる最適化の主な目的はどれか。,1,プログラムの実行時間を短縮する。,プログラムのデバッグを容易にする。,プログラムの保守性を改善する。,目的プログラムを生成する時間を短縮する。,平成22年秋期 午前問22
仮想記憶方式では，割り当てられる実記憶の容量が小さいとページアウト，ページインが頻発し，処理能力が低下することがある。このような現象を何というか。,1,スラッシング,スワッピング,フラグメンテーション,メモリリーク,平成22年秋期 午前問21
スループットに関する記述のうち，適切なものはどれか。,4,ジョブとジョブの実行の間にオペレータが介入することによってシステムに遊休時間が生じても，スループットには影響を及ぼさない。,スループットはCPU性能の指標であり，入出力の速度，オーバヘッド時間などによって影響を受けない。,多重プログラミングはターンアラウンドタイムの短縮に貢献するが，スループットの向上にはあまり役立たない。,プリンタへの出力を一時的に磁気ディスク装置へ保存するスプーリングは，スループットの向上に役立つ。,平成22年秋期 午前問18
バックアップシステム構成におけるホットサイトに関する記述として，適切なものはどれか。,2,共同利用型のサイトを用意しておき，障害発生時に，バックアップしておいたデータやプログラムの媒体を搬入してシステムを復元し，業務を再開する。,待機系サイトとして稼働させておき，ネットワークを介して常時データやプログラムの更新を行い，障害発生時に速やかに業務を再開する。,予備のサイトにハードウェアを用意して，定期的にバックアップしたデータやプログラムの媒体を搬入して保管しておき，障害発生時にはこれら保管物を活用してシステムを復元し，業務を再開する。,予備のサイトをあらかじめ確保しておいて，障害発生時には必要なハードウェア，バックアップしておいたデータやプログラムの媒体を搬入し，業務を再開する。,平成22年秋期 午前問16
デイジーチェーン接続はどれか。,1,IEEE1394接続コネクタが2口ある工業用カメラを数珠つなぎにし，一端をPCに接続する。,PCと計測機器とをRS-232Cで接続し，PCとプリンタとをUSBを用いて接続する。,USBハブにキーボード，マウス，プリンタをつなぎ，USBハブとPCとを接続する。,数台のネットワークカメラ及びPCをネットワークハブに接続する。,平成22年秋期 午前問13
