キャッシュメモリに関する記述のうち，適切なものはどれか。,1,書込み命令を実行したときに，キャッシュメモリと主記憶の両方を書き換える方式と，キャッシュメモリだけを書き換えておき，主記憶の書換えはキャッシュメモリから当該データが追い出されるときに行う方式とがある。,キャッシュメモリにヒットしない場合に割込みが生じ，プログラムによって主記憶からキャッシュメモリにデータが転送される。,キャッシュメモリは，実記憶と仮想記憶とのメモリ容量の差を埋めるために採用される。,半導体メモリのアクセス速度の向上が著しいので，キャッシュメモリの必要性は減っている。,平成22年秋期 午前問12
内部割込みに分類されるものはどれか。,2,商用電源の瞬時停電などの電源異常による割込み,ゼロで除算を実行したことによる割込み,入出力が完了したことによる割込み,メモリパリティエラーが発生したことによる割込み,平成22年秋期 午前問11
パイプライン制御の特徴はどれか。,3,複数の命令を同時実行するために，コンパイラが目的プログラムを生成する段階で，それぞれの命令がどの演算器を使うかをあらかじめ割り振る。,命令が実行される段階で，どの演算器を使うかを動的に決めながら，複数の命令を同時に実行する。,命令の処理をプロセッサ内で複数のステージに細分化し，複数の命令を並列に実行する。,命令を更に細かなマイクロ命令の組合せで実行する。,平成22年秋期 午前問10
平均命令実行時間が20ナノ秒のコンピュータがある。このコンピュータの性能は何MIPSか。,4,5,10,20,50,平成22年秋期 午前問9
Javaのプログラムにおいて，よく使われる機能などを部品化し，再利用できるようにコンポーネント化するための仕様はどれか。,1,JavaBeans,JavaScript,Javaアプリケーション,Javaアプレット,平成22年秋期 午前問8
A，B，C，Dの順に到着するデータに対して，一つのスタックだけを用いて出力可能なデータ列はどれか。,3,A，D，B，C,B，D，A，C,C，B，D，A,D，C，A，B,平成22年秋期 午前問5
送信側では，ビット列をある生成多項式で割った余りをそのビット列に付加して送信し，受信側では，受信したビット列が同じ生成多項式で割り切れるか否かで誤りの発生を判断する誤り検査方式はどれか。,1,CRC方式,垂直パリティチェック方式,水平パリティチェック方式,ハミング符号方式,平成22年秋期 午前問4
けた落ちの説明として，適切なものはどれか。,1,値がほぼ等しい浮動小数点同士の減算において，有効けた数が大幅に減ってしまうことである。,演算結果が，扱える数値の最大値を超えることによって生じる誤差のことである。,数表現のけた数に限度があるとき，最小のけたより小さい部分について四捨五入，切上げ又は切捨てを行うことによって生じる誤差のことである。,浮動小数点の加算において，一方の数値の下位のけたが結果に反映されないことである。,平成22年秋期 午前問2
16進小数3A.5Cを10進数の分数で表したものはどれか。,2,939/16,3735/64,14939/256,14941/256,平成22年秋期 午前問1
