RDBMSが二つの表を結合する方法のうち，ソートマージ結合法に関する記述はどれか。,4,一方の表の結合する列がインデックスに含まれている場合，もう一方の表の結合する列とインデックスの値で結合する。,一方の表の結合する列の値でハッシュ表を作成し，もう一方の表の結合する列と結合する。,一方の表の結合する列の値を順に読み出し，もう一方の表の結合する列と結合する。,結合する列の値で並べ替えたそれぞれの表の行を，先頭から順に結合する。,平成29年春期 午前問27
音声などのアナログデータをディジタル化するために用いられるPCMにおいて，音の信号を一定の周期でアナログ値のまま切り出す処理はどれか。,2,暗号化,標本化,符号化,量子化,平成29年春期 午前問24
顧客に，A～Zの英大文字26種類を用いた顧客コードを割り当てたい。現在の顧客総数は8000人であって，新規顧客が毎年2割ずつ増えていくものとする。3年後まで顧客全員にコードを割り当てられるようにするためには，顧客コードは少なくとも何桁必要か。,1,3,4,5,6,平成29年春期 午前問23
変形を感知するセンサを用いると，高架道路などの状態を監視してメンテナンスすることが可能である。この目的で使用されているセンサはどれか。,3,サーミスタ,ジャイロ,ひずみゲージ,ホール素子,平成29年春期 午前問21
分解能が8ビットのD/A変換器に，ディジタル値0を入力したときの出力電圧が0Vとなり，ディジタル値128を入力したときの出力電圧が2.5Vとなる場合，最下位の1ビットの変化による当該D/A変換器の出力電圧の変化は何Vか。,1,2.5／128,2.5／255,2.5／256,2.5／512,平成29年春期 午前問20
仮想記憶方式のコンピュータにおいて，実記憶に割り当てられるページ数は3とし，追い出すページを選ぶアルゴリズムは，FIFOとLRUの二つ考える。あるタスクのページアクセス順序が     1、 3、 2、 1、 4、 5、 2、 3、 4、 5     のとき，ページを置き換える回数の組合せとして適切なものはどれか。,2,FIFO = 3     LRU = 2,FIFO = 3     LRU = 6,FIFO = 4     LRU = 3,FIFO = 5     LRU = 4,平成29年春期 午前問19
ページング方式の説明として，適切なものはどれか。,1,仮想記憶空間と実記憶空間を，固定長の領域に区切り，対応づけて管理する方式,主記憶装置の異なった領域で実行できるように，プログラムを再配置する方式,主記憶装置を，同時に並行して読み書き可能な複数の領域に分ける方式,補助記憶装置に，複数のレコードをまとめて読み書きする方式,平成29年春期 午前問15
ベンチマークテストの説明として，適切なものはどれか。,2,監視・計測用のプログラムによってシステムの稼働状態や資源の状況を測定し，システム構成や応答性能のデータを得る。,使用目的に合わせて選定した標準的なプログラムを実行させ，その処理性能を測定する。,将来の予測を含めて評価する場合などに，モデルを作成して模擬的に実験するプログラムでシステムの性能を評価する。,プログラムを実際には実行せずに，机上でシステムの処理を解析して，個々の命令の出現回数や実行回数の予測値から処理時間を推定し，性能を評価する。,平成29年春期 午前問13
システムの性能を向上させるために，スケールアウトが適しているシステムはどれか。,2,一連の大きな処理を一括して実行しなければならないので，並列処理が困難な処理が中心のシステム,参照系のトランザクションが多いので，複数のサーバで分散処理を行っているシステム,データを追加するトランザクションが多いので，データの整合性を取るためのオーバヘッドを小さくしなければならないシステム,同一のマスタデータベースがシステム内に複数配置されているので，マスタを更新する際にはデータベース間で整合性を保持しなければならないシステム,平成29年春期 午前問12
4Tバイトのデータを格納できるようにRAID1の外部記憶装置を構成するとき，フォーマット後の記憶容量が1Tバイトの磁気記憶装置は少なくとも何台必要か。,4,4,5,6,8,平成29年春期 午前問11
USB3.0の説明として，適切なものはどれか。,4,1クロックで2ビットの情報を伝送する4対の信号線を使用し，最大1Gビット／秒のスループットをもつインタフェースである。,PCと周辺機器とを接続するATA仕様をシリアル化したものである。,音声，映像などに適したアイソクロナス転送を採用しており，ブロードキャスト転送モードをもつシリアルインタフェースである。,スーパースピードと呼ばれる5Gビット／秒のデータ転送モードをもつシリアルインタフェースである。,平成29年春期 午前問10
キャッシュの書込み方式には，ライトスルー方式とライトバック方式がある。ライトバック方式を使用する目的として，適切なものはどれか。,4,キャッシュと主記憶の一貫性(コヒーレンシ)を保ちながら，書込みを行う。,キャッシュミスが発生したときに，キャッシュの内容の主記憶への書き戻しを不要にする。,個々のプロセッサがそれぞれのキャッシュをもつマルチプロセッサシステムにおいて，キャッシュ管理をライトスルー方式よりも簡単な回路構成で実現する。,プロセッサから主記憶への書込み頻度を減らす。,平成29年春期 午前問9
顧客番号をキーとして顧客データを検索する場合，2分探索を使用するのが適しているものはどれか。,3,顧客番号から求めたハッシュ値が指し示す位置に配置されているデータ構造,顧客番号に関係なく，ランダムに配置されているデータ構造,顧客番号の昇順に配置されているデータ構造,顧客番号をセルに格納し，セルのアドレス順に配置されているデータ構造,平成29年春期 午前問7
関数 f(x，y)が次のように定義されているとき，f(775，527)の値は幾らか。ここで，x mod yはxをyで割った余りを返す。     f(x，y): if y = 0 then return x else return f(y，x mod y),2,0,31,248,527,平成29年春期 午前問6
データ構造の一つであるリストは，配列を用いて実現する場合と，ポインタを用いて実現する場合とがある。配列を用いて実現する場合の特徴はどれか。ここで，配列を用いたリストは，配列に要素を連続して格納することによって構成し，ポインタを用いたリストは，要素から次の要素へポインタで連結することによって構成するものとする。,1,位置を指定して，任意のデータに直接アクセスすることができる。,並んでいるデータの先頭に任意のデータを効率的に挿入することができる。,任意のデータの参照は効率的ではないが，削除や挿入の操作を効率的に行える。,任意のデータを別の位置に移動する場合，隣接するデータを移動せずにできる。,平成29年春期 午前問4
XとYの否定論理積 X NAND Yは，NOT(X AND Y)として定義される。X OR YをNANDだけを使って表した論理式はどれか。,2,((X NAND Y) NAND X) NAND Y,(X NAND X) NAND (Y NAND Y),(X NAND Y) NAND (X NAND Y),X NAND (Y NAND (X NAND Y)),平成29年春期 午前問3
0以外の数値を浮動小数点表示で表現する場合，仮数部の最上位桁が0以外になるように，桁合わせする操作はどれか。ここで，仮数部の表現方法は，絶対値表現とする。,4,切上げ,切捨て,桁上げ,正規化,平成29年春期 午前問2
集合A，B，Cを使った等式のうち，集合A，B，Cの内容によらず常に成立する等式はどれか。ここで，∪は和集合，∩は積集合を示す。,4,(A∪B)∩(A∩C) ＝ B∩(A∪C),(A∪B)∩C ＝ (A∪C)∩(B∪C),(A∩C)∪(B∩A) ＝ (A∩B)∪(B∩C),(A∩C)∪(B∩C) ＝ (A∪B)∩C,平成29年春期 午前問1
