不正競争防止法において，営業秘密となる要件は，"秘密として管理されていること"，"事業活動に有用な技術上又は経営上の情報であること"ともう一つはどれか。,3,営業譲渡が可能なこと,期間が10年を超えないこと,公然と知られていないこと,特許出願をしていること,平成29年春期 午前問80
著作権法によるソフトウェアの保護範囲に関する記述のうち，適切なものはどれか。,4,アプリケーションプログラムは著作権法によって保護されるが，OSなどの基本プログラムは権利の対価がハードウェアの料金に含まれるので，保護されない。,アルゴリズムやプログラム言語は，著作権法によって保護される。,アルゴリズムを記述した文書は著作権法で保護されるが，そのアルゴリズムを用いて作成されたプログラムは保護されない。,ソースプログラムとオブジェクトプログラムの両方とも著作権法によって保護される。,平成29年春期 午前問79
当期の建物の減価償却費を計算すると，何千円になるか。ここで，建物の取得価額は10000千円，前期までの減価償却累計額は3000千円であり，償却方法は定額法，会計期間は1年間，耐用年数は20年とし，残存価額は0円とする。,3,150,350,500,650,平成29年春期 午前問78
キャッシュフロー計算書において，営業活動によるキャッシュフローに該当するものはどれか。,2,株式の発行による収入,商品の仕入れによる支出,短期借入金の返済による支出,有形固定資産の売却による収入,平成29年春期 午前問77
親和図法を説明したものはどれか。,2,事態の進展とともに様々な事象が想定される問題について対応策を検討し，望ましい結果に至るプロセスを定める方法である。,収集した情報を相互の関連によってグループ化し，解決すべき問題点を明確にする方法である。,複雑な要因の絡み合う事象について，その事象間の因果関係を明らかにする方法である。,目的・目標を達成するための手段・方策を順次展開し，最適な手段・方策を追求していく方法である。,平成29年春期 午前問76
会議におけるファシリテータの役割として，適切なものはどれか。,3,技術面や法律面など，自らが専門とする特定の領域の議論に対してだけ，助言を行う。,議長となり，経営層の意向に合致した結論を導き出すように議論をコントロールする。,中立公平な立場から，会議の参加者に発言を促したり，議論の流れを整理したりする。,日程調整・資料準備・議事録作成など，会議運営の事務的作業に特化した支援を行う。,平成29年春期 午前問75
CGM(Consumer Generated Media)の説明はどれか。,2,オークション形式による物品の売買機能を提供することによって，消費者同士の個人売買の仲介役を果たすもの,個人が制作したディジタルコンテンツの閲覧者・視聴者への配信や利用者同士の共有を可能とするもの,個人商店主のオンラインショップを集め，共通ポイントの発行やクレジットカード決済を代行するもの,自社の顧客のうち，希望者をメーリングリストに登録し，電子メールを通じて定期的に情報を配信するもの,平成29年春期 午前問73
"かんばん方式"を説明したものはどれか。,3,各作業の効率を向上させるために，仕様が統一された部品，半製品を調達する。,効率よく部品調達を行うために，関連会社から部品を調達する。,中間在庫を極力減らすために，生産ラインにおいて，後工程が自工程の生産に合わせて，必要な部品を前工程から調達する。,より品質が高い部品を調達するために，部品の納入指定業者を複数定め，競争入札で部品を調達する。,平成29年春期 午前問72
バランススコアカードの学習と成長の視点における戦略目標と業績評価指標の例はどれか。,3,持続的成長が目標であるので，受注残を指標とする。,主要顧客との継続的な関係構築が目標であるので，クレーム件数を指標とする。,製品開発力の向上が目標であるので，製品開発領域の研修受講時間を指標とする。,製品の納期遵守が目標であるので，製造期間短縮日数を指標とする。,平成29年春期 午前問70
アンゾフが提唱した成長マトリクスにおいて，既存市場に対して既存製品で事業拡大する場合の戦略はどれか。,2,市場開発,市場浸透,製品開発,多角化,平成29年春期 午前問69
競争上のポジションで，ニッチャの基本戦略はどれか,3,シェア迫撃などのリーダ攻撃に必要な差別化戦略,市場チャンスに素早く対応する模倣戦略,製品，市場の専門特化を図る特定化戦略,全市場をカバーし，最大シェアを確保する全方位戦略,平成29年春期 午前問68
コアコンピタンスの説明はどれか。,1,企業の活動分野において，競合他社にはまねのできない卓越した能力,経営を行う上で法令や各種規制，社会的規範などを遵守する企業活動,市場・技術・商品(サービス)の観点から設定した，事業の展開領域,組織活動の目的を達成するために行う，業務とシステムの全体最適化手法,平成29年春期 午前問67
企画，要件定義，システム開発，ソフトウェア実装，ハードウェア実装，保守から成る一連のシステム開発プロセスにおいて，要件定義プロセスで実施すべきものはどれか。,2,事業の目的，目標を達成するために必要なシステム化の方針，及びシステムを実現するための実施計画を立案する。,システムに関わり合いをもつ利害関係者の種類を識別し，利害関係者のニーズ，要望及び課せられる制約条件を識別する。,目的とするシステムを得るために，システムの機能及び能力を定義し，システム方式設計によってハードウェア，ソフトウェアなどによる実現方式を確立する。,利害関係者の要件を満足するソフトウェア製品又はソフトウェアサービスを得るための，方式設計と適格性の確認を実施する。,平成29年春期 午前問66
非機能要件の定義で行う作業はどれか。,2,業務を構成する機能間の情報(データ)の流れを明確にする。,システム開発で用いるプログラム言語に合わせた開発基準，標準の技術要件を作成する。,システム機能として実現する範囲を定義する。,他システムとの情報授受などのインタフェースを明確にする。,平成29年春期 午前問65
BYOD(Bring Your Own Device)の説明はどれか。,4,会社から貸与された情報機器を常に携行して業務にあたること,会社所有のノートPCなどの情報機器を社外で私的に利用すること,個人所有の情報機器を私的に使用するために利用環境を設定すること,従業員が個人で所有する情報機器を業務のために使用すること,平成29年春期 午前問64
ホスティングサービスの特徴はどれか。,2,運用管理面では，サーバの稼働監視，インシデント対応などを全て利用者が担う。,サービス事業者が用意したサーバの利用権を利用者に貸し出す。,サービス事業者の高性能なサーバを利用者が専有するような使い方には対応しない。,サービス事業者の施設に利用者が独自のサーバを持ち込み，サーバの選定や組合せは自由に行う。,平成29年春期 午前問63
ITサービスをアウトソーシングする際の，システム保守品質・運用品質の低下リスクへの対応策はどれか。,3,アウトソーシング後の自社の人材強化計画の提案を，委託先の選定段階で求め，契約書などにも明文化しておく。,サービス費用の妥当性を検証できるように，サービス別の詳細な料金体系を契約書などで明文化しておく。,サービス品質を示す指標を用い，目標とする品質のレベルを委託先と取り決めた上で，サービス品質の改善活動を進めていく。,システム保守・運用実務などのサービス費用について，査定能力をもつ人材を自社側に確保しておく。,平成29年春期 午前問62
リスクや投資価値の類似性で分けたカテゴリごとの情報化投資について，最適な資源配分を行う手法はどれか。,2,3C分析,ITポートフォリオ,エンタープライズアーキテクチャ,ベンチマーキング,平成29年春期 午前問61
システム監査の実施体制に関する記述のうち，適切なものはどれか。,1,監査依頼者が監査報告に基づく改善指示を行えるように，システム監査人は監査結果を監査依頼者に報告する。,業務監査の一部として情報システムの監査を行う場合には，利用部門のメンバによる監査チームを編成して行う。,システム監査人が他の専門家の支援を受ける場合には，支援の範囲・方法，及び監査結果の判断などは，ほかの専門家の責任において行う。,情報システム部門における開発状況の監査を行う場合には，開発内容を熟知した情報システム部門のメンバによる監査チームを編成して行う。,平成29年春期 午前問60
システムに関わるドキュメントが漏えい，改ざん，不正使用されるリスクに対するコントロールを監査する際のチェックポイントはどれか。,2,システムの変更に伴い，ドキュメントを遅滞なく更新していること,ドキュメントの機密性を確保するための対策を講じていること,ドキュメントの標準化を行っていること,プロトタイプ型開発においても，必要なドキュメントを作成していること,平成29年春期 午前問59
システム監査人が，監査報告書の原案について被監査部門と意見交換を行う目的として，最も適切なものはどれか。,3,監査依頼者に監査報告書を提出する前に，被監査部門に監査報告を行うため,監査報告書に記載する改善勧告について，被監査部門の責任者の承認を受けるため,監査報告書に記載する指摘事項及び改善勧告について，事実誤認がないことを確認するため,監査報告書の記載内容に関して調査が不足している事項を被監査部門に口頭で確認することによって，不足事項の追加調査に代えるため,平成29年春期 午前問58
ITサービスマネジメントの活動のうち，インシデント管理及びサービス要求管理として行うものはどれか。,4,サービスデスクに対する顧客満足度が合意したサービス目標を満たしているかどうかを評価し，改善の機会を特定するためにレビューする。,ディスクの空き容量がしきい値に近づいたので，対策を検討する。,プログラム変更を行った場合の影響度を調査する。,利用者からの障害報告を受けて，既知の誤りに該当するかどうかを照合する。,平成29年春期 午前問57
システムの開発部門と運用部門が別々に組織化されているとき，開発から運用への移行を円滑かつ効果的に進めるための方法のうち，適切なものはどれか。,3,運用テストの完了後に，開発部門がシステム仕様と運用方法を運用部門に説明する。,運用テストは，開発部門の支援を受けずに，運用部門だけで実施する。,運用部門からもシステムの運用に関わる要件の抽出に積極的に参加する。,開発部門は運用テストを実施して，運用マニュアルを作成し，運用部門に引き渡す。,平成29年春期 午前問56
サービスマネジメントシステムにおけるサービスの可用性はどれか。,1,あらかじめ合意された時点又は期間にわたって，要求された機能を実行するサービス又はサービスコンポーネントの能力,計画した活動が実行され，計画した結果が達成された程度,合意したレベルでサービスを継続的に提供するために，サービスに深刻な影響を及ぼす可能性のあるリスク及び事象を管理する能力,サービスの要求事項を満たし，サービスの設計，移行，提供及び改善のために，サービス提供者の活動及び資源を，指揮し，管理する，一連の能力及びプロセス,平成29年春期 午前問55
システム開発の進捗管理などに用いられるトレンドチャートの説明はどれか。,3,作業に関与する人と責任をマトリックス状に示したもの,作業日程の計画と実績を対比できるように帯状に示したもの,作業の進捗状況と，予算の消費状況を関連付けて折れ線で示したもの,作業の順序や相互関係をネットワーク状に示したもの,平成29年春期 午前問54
システム開発の見積方法の一つであるファンクションポイント法の説明として，適切なものはどれか。,3,開発規模が分かっていることを前提として，工数と工期を見積もる方法である。ビジネス分野に限らず，全分野に適用可能である。,過去に経験した類似のシステムについてのデータを基にして，システムの相違点を調べ，同じ部分については過去のデータを使い，異なった部分は経験から規模と工数を見積もる方法である。,システムの機能を入出力データ数やファイル数などによって定量的に計測し，複雑さとアプリケーションの特性による調整を行って，システム規模を見積もる方法である。,単位作業量の基準値を決めておき，作業項目を単位作業項目まで分解し，その積算で全体の作業量を見積もる方法である。,平成29年春期 午前問52
ソフトウェア開発の活動のうち，アジャイル開発においても重視されているリファクタリングはどれか。,2,ソフトウェアの品質を高めるために，2人のプログラマが協力して，一つのプログラムをコーディングする。,ソフトウェアの保守性を高めるために，外部仕様を変更することなく，プログラムの内部構造を変更する。,動作するソフトウェアを迅速に開発するために，テストケースを先に設定してから，プログラムをコーディングする。,利用者からのフィードバックを得るために，提供予定のソフトウェアの試作品を早期に作成する。,平成29年春期 午前問50
オブジェクト指向の基本概念の組合せとして，適切なものはどれか。,4,仮想化，構造化，投影，クラス,具体化，構造化，連続，クラス,正規化，カプセル化，分割，クラス,抽象化，カプセル化，継承，クラス,平成29年春期 午前問48
ソフトウェアのレビュー方法の説明のうち，インスペクションはどれか。,3,作成者を含めた複数人の関係者が参加して会議形式で行う。レビュー対象となる成果物を作成者が説明し，参加者が質問やコメントをする。,参加者が順番に司会者とレビュアになる。司会者の進行によって，レビュア全員が順番にコメントをし，全員が発言したら，司会者を交代して次のテーマに移る。,モデレータが全体のコーディネートを行い，参加者が明確な役割をもってチェックリストなどに基づいたコメントをし，正式な記録を残す。,レビュー対象となる成果物を複数のレビュアに配布又は回覧して，レビュアがコメントをする。,平成29年春期 午前問47
システムの外部設計を完了させるとき，顧客から承認を受けるものはどれか。,1,画面レイアウト,システム開発計画,物理データベース仕様,プログラム流れ図,平成29年春期 午前問46
Webサーバの検査におけるポートスキャナの利用目的はどれか。,1,Webサーバで稼働しているサービスを列挙して，不要なサービスが稼働していないことを確認する。,Webサーバの利用者IDの管理状況を運用者に確認して，情報セキュリティポリシからの逸脱がないことを調べる。,Webサーバへのアクセス履歴を解析して，不正利用を検出する。,正規の利用者IDでログインし，Webサーバのコンテンツを直接確認して，コンテンツの脆(ぜい)弱性を検出する。,平成29年春期 午前問45
電子メールの送信時に，送信者を送信側のメールサーバで認証するためのものはどれか。,4,APOP,POP3S,S/MIME,SMTP-AUTH,平成29年春期 午前問44
1台のファイアウォールによって，外部セグメント，DMZ，内部セグメントの三つのセグメントに分割されたネットワークがある。このネットワークにおいて，Webサーバと，重要なデータをもつデータベースサーバから成るシステムを使って，利用者向けのサービスをインターネットに公開する場合，インターネットからの不正アクセスから重要なデータを保護するためのサーバの設置方法のうち，最も適切なものはどれか。ここで，ファイアウォールでは，外部セグメントとDMZとの間及びDMZと内部セグメントとの間の通信は特定のプロトコルだけを許可し，外部セグメントと内部セグメントとの間の直接の通信は許可しないものとする。,3,WebサーバとデータベースサーバをDMZに設置する。,Webサーバとデータベースサーバを内部セグメントに設置する。,WebサーバをDMZに，データベースサーバを内部セグメントに設置する。,Webサーバを外部セグメントに，データベースサーバをDMZに設置する。,平成29年春期 午前問43
情報セキュリティにおけるタイムスタンプサービスの説明はどれか。,3,公式の記録において使われる全世界共通の日時情報を，暗号化通信を用いて安全に表示するWebサービス,指紋，声紋，静脈パターン，網膜，虹彩などの生体情報を，認証システムに登録した日時を用いて認証するサービス,電子データが，ある日時に確かに存在していたこと，及びその日時以降に改ざんされていないことを証明するサービス,ネットワーク上のPCやサーバの時計を合わせるための日時情報を途中で改ざんされないように通知するサービス,平成29年春期 午前問41
公開鍵暗号方式の暗号アルゴリズムはどれか。,3,AES,KCipher-2,RSA,SHA-256,平成29年春期 午前問40
経済産業省とIPAが策定した"サイバーセキュリティ経営ガイドライン(Ver1.1)"が，自社のセキュリティ対策に加えて，実施状況を確認すべきとしている対策はどれか。,3,自社が提供する商品及びサービスの個人利用者が行うセキュリティ対策,自社に出資している株主が行うセキュリティ対策,自社のサプライチェーンのビジネスパートナが行うセキュリティ対策,自社の事業所近隣の地域社会が行うセキュリティ対策,平成29年春期 午前問39
共通鍵暗号の鍵を見つけ出そうとする，ブルートフォース攻撃に該当するものはどれか。,1,一組みの平文と暗号文が与えられたとき，全ての鍵候補を一つずつ試して鍵を見つけ出す。,平文と暗号文と鍵の関係を表す代数式を手掛かりにして鍵を見つけ出す。,平文の一部分の情報と，暗号文の一部分の情報との間の統計的相関を手掛かりにして鍵を見つけ出す。,平文を一定量変化させたときの暗号文の変化から鍵を見つけ出す。,平成29年春期 午前問38
ディレクトリトラバーサル攻撃に該当するものはどれか。,2,攻撃者が，Webアプリケーションの入力データとしてデータベースへの命令文を構成するデータを入力し，管理者の意図していないSQL文を実行させる。,攻撃者が，パス名を使ってファイルを指定し，管理者の意図していないファイルを不正に閲覧する。,攻撃者が，利用者をWebサイトに誘導した上で，WebアプリケーションによるHTML出力のエスケープ処理の欠陥を悪用し，利用者のWebブラウザで悪意のあるスクリプトを実行させる。,セッションIDによってセッションが管理されるとき，攻撃者がログイン中の利用者のセッションIDを不正に取得し，その利用者になりすましてサーバにアクセスする。,平成29年春期 午前問37
攻撃者が用意したサーバXのIPアドレスが，A社WebサーバのFQDNに対応するIPアドレスとして，B社DNSキャッシュサーバに記憶された。この攻撃によって，意図せずサーバXに誘導されてしまう利用者はどれか。ここで，A社，B社の各従業員は自社のDNSキャッシュサーバを利用して名前解決を行う。,2,A社WebサーバにアクセスしようとするA社従業員,A社WebサーバにアクセスしようとするB社従業員,B社WebサーバにアクセスしようとするA社従業員,B社WebサーバにアクセスしようとするB社従業員,平成29年春期 午前問36
OpenFlowを使ったSDN(Software-Defined Networking)の説明として，適切なものはどれか。,3,RFIDを用いるIoT(Internet of Things)技術の一つであり，物流ネットワークを最適化するためのソフトウェアアーキテクチャ,音楽や動画，オンラインゲームなどの様々なソフトウェアコンテンツをインターネット経由で効率的に配信するために開発された，ネットワーク上のサーバの最適配置手法,データ転送と経路制御の機能を論理的に分離し，データ転送に特化したネットワーク機器とソフトウェアによる経路制御の組合せで実現するネットワーク技術,データフロー図やアクティビティ図などを活用して，業務プロセスの問題点を発見し改善を行うための，業務分析と可視化ソフトウェアの技術,平成29年春期 午前問35
IPv4アドレス 128.0.0.0 を含むアドレスクラスはどれか。,2,クラスA,クラスB,クラスC,クラスD,平成29年春期 午前問34
ルータがパケットの経路決定に用いる情報として，最も適切なものはどれか。,1,宛先IPアドレス,宛先MACアドレス,発信元IPアドレス,発信元MACアドレス,平成29年春期 午前問33
OSI基本参照モデルのトランスポート層以上が異なるLANシステム相互間でプロトコル変換を行う機器はどれか。,1,ゲートウェイ,ブリッジ,リピータ,ルータ,平成29年春期 午前問31
本社と工場との間を専用線で接続してデータを伝送するシステムがある。このシステムでは2000バイト／件の伝票データを2件ずつまとめ，それに400バイトのヘッダ情報を付加して送っている。伝票データは，1時間に平均100000件発生している。回線速度を1Mビット／秒としたとき，回線利用率はおよそ何%か。,3,6.1,44,49,53,平成29年春期 午前問30
ビッグデータの活用例として，大量のデータから統計学的手法などを用いて新たな知識(傾向やパターン)を見つけ出すプロセスはどれか。,3,データウェアハウス,データディクショナリ,データマイニング,メタデータ,平成29年春期 午前問29
分散データベースシステムにおいて，一連のトランザクション処理を行う複数サイトに更新処理が確定可能かどうかを問い合わせ，すべてのサイトが確定可能である場合，更新処理を確定する方式はどれか。,1,2相コミット,排他制御,ロールバック,ロールフォワード,平成29年春期 午前問28
